{
  "$schema": "https://json-schema.org/draft/2020-12/schema",
  "$id": "https://github.com/TransactionTree/transactiontree-schemas/blob/main/customfield/1.0/Group/getAttributeGroupData/getAttributeGroupData-response.schema.json",
  "title": "getAttributeGroupData response (success)",
  "description": "Success reply (response_code 'S200'). Any call may instead return the error envelope (see common.schema.json#/$defs/ErrorResponse and the family README error table).",
  "type": "object",
  "allOf": [
    {
      "$ref": "../../common.schema.json#/$defs/ResponseEnvelope"
    }
  ],
  "properties": {
    "domain_entity_id": {
      "type": "string"
    },
    "domain_entity_type": {
      "type": "string"
    },
    "grouping_code": {
      "type": [
        "string",
        "null"
      ]
    },
    "grouping_code_id": {
      "type": [
        "string",
        "null"
      ]
    },
    "grouping_code_desc": {
      "type": [
        "string",
        "null"
      ]
    },
    "group": {
      "oneOf": [
        {
          "$ref": "../../common.schema.json#/$defs/GroupObject"
        },
        {
          "type": "null"
        }
      ]
    },
    "response_code": {
      "type": "string"
    },
    "response_ref_id": {
      "type": "string"
    },
    "response_code_desc": {
      "type": "string"
    }
  }
}
